{
  "schemaVersion": "crawler-research/v1",
  "storyId": "dcc",
  "floor": 3,
  "sources": [
    {
      "id": "src-book-2",
      "kind": "official-text",
      "trust": "primary",
      "title": "Dungeon Crawler Carl, Book 2: Carl's Doomsday Scenario",
      "url": "https://www.mattdinniman.com/",
      "citationStyle": "Chapter {chapter}"
    },
    {
      "id": "src-wiki-third-floor",
      "kind": "wiki",
      "trust": "corroborating",
      "title": "The Over City (Third Floor)",
      "url": "https://dungeon-crawler-carl.fandom.com/wiki/Third_Floor"
    }
  ],
  "claims": [
    {
      "id": "P3-PET-001",
      "domain": "pet",
      "kind": "event",
      "claim": {
        "summary": "Mongo reaches Level 3 and grows substantially after entering Floor 3.",
        "detail": "Book 2, Ch. 5 establishes Mongo reaches Level 3 after entering Floor 3."
      },
      "evidence": [
        {
          "sourceId": "src-book-2",
          "locator": {
            "book": 2,
            "chapter": 5
          },
          "confidence": "confirmed"
        }
      ],
      "modeling": {
        "decision": "promote",
        "targetDomain": "pet",
        "targetRepresentation": "PetAcquired"
      },
      "candidateRepresentation": {
        "type": "PetAcquired",
        "pet": {
          "petId": "pet-mongo",
          "species": "Velociraptor",
          "origin": "dungeon-origin",
          "classification": "pet-class",
          "hostility": "non-hostile",
          "bondState": "bonded",
          "bondHolderCrawlerId": "crawler-donut"
        },
        "summary": "Mongo reaches Level 3."
      }
    },
    {
      "id": "P3-PET-002",
      "domain": "pet",
      "kind": "state",
      "claim": {
        "summary": "Donut receives magical tracking collar for Mongo from Gold Pet Box.",
        "detail": "Book 2, Ch. 5 establishes tracking collar acquisition."
      },
      "evidence": [
        {
          "sourceId": "src-book-2",
          "locator": {
            "book": 2,
            "chapter": 5
          },
          "confidence": "confirmed"
        }
      ],
      "dependencies": [
        "P3-PET-001"
      ],
      "modeling": {
        "decision": "promote",
        "targetDomain": "inventory",
        "targetRepresentation": "ItemAcquired"
      },
      "candidateRepresentation": {
        "type": "ItemAcquired",
        "item": {
          "instanceId": "inst-f3-mongo-tracking-collar",
          "itemId": "item-mongo-tracking-collar",
          "quantity": {
            "known": true,
            "value": 1
          }
        },
        "summary": "Donut receives magical tracking collar for Mongo."
      }
    },
    {
      "id": "P3-INV-001",
      "domain": "inventory",
      "kind": "event",
      "claim": {
        "summary": "Carl encapsulates active Soul Crystal in Sheol Glass Reaper Case, creating Carl's Doomsday Scenario.",
        "detail": "Book 2, Ch. 25 item crafting/encapsulation event."
      },
      "evidence": [
        {
          "sourceId": "src-book-2",
          "locator": {
            "book": 2,
            "chapter": 25
          },
          "confidence": "confirmed"
        }
      ],
      "modeling": {
        "decision": "promote",
        "targetDomain": "inventory",
        "targetRepresentation": "ItemCrafted"
      },
      "candidateRepresentation": {
        "type": "ItemCrafted",
        "item": {
          "instanceId": "inst-f3-carls-doomsday-scenario",
          "itemId": "item-carls-doomsday-scenario",
          "quantity": {
            "known": true,
            "value": 1
          }
        },
        "summary": "Carl encapsulates active Soul Crystal creating Carl's Doomsday Scenario."
      }
    },
    {
      "id": "P3-PET-003",
      "domain": "pet",
      "kind": "ledger-only",
      "claim": {
        "summary": "Donut learns Clockwork Triplicate, producing two clockwork Mongo copies.",
        "detail": "Spell capability research handoff for #181/#184; maintained as ledger-only context."
      },
      "evidence": [
        {
          "sourceId": "src-book-2",
          "locator": {
            "book": 2,
            "chapter": 5
          },
          "confidence": "confirmed"
        }
      ],
      "modeling": {
        "decision": "ledger_only",
        "note": "Ledger-only research handoff for #181/#184"
      }
    },
    {
      "id": "P3-SYS-001",
      "domain": "floor-system",
      "kind": "observation",
      "claim": {
        "summary": "Floor 3 has an eight-day collapse timer.",
        "detail": "Conceptual countdown declared; no exact runtime seconds invented."
      },
      "evidence": [
        {
          "sourceId": "src-wiki-third-floor",
          "locator": {
            "section": "Floor Rules"
          },
          "confidence": "corroborated"
        }
      ],
      "unknowns": [
        "exact_timestamp"
      ],
      "modeling": {
        "decision": "review",
        "targetDomain": "floor-system",
        "targetRepresentation": "CountdownDeclared",
        "note": "Requires human review before runtime countdown instantiation"
      }
    }
  ]
}
